{"schema_version":1,"kind":"third_party_sources","artifact_id":"rust-analyzer","tool_version":"2026-07-27","upstream_repository":"rust-lang/rust-analyzer","upstream_tag":"2026-07-27","upstream_commit":"12c3381f0b17b8eec21075d1c72fd010996a9bda","assets":[{"platform_id":"darwin-amd64","target_triple":"x86_64-apple-darwin","url":"https://github.com/rust-lang/rust-analyzer/releases/download/2026-07-27/rust-analyzer-x86_64-apple-darwin.gz","archive_name":"rust-analyzer-x86_64-apple-darwin.gz","archive_size":14715786,"archive_sha256":"9d1a60991ead6c27baa9d265fc8fd03bba9c39cf0ec2aaf389e37e6155af7cbb","executable_name":"rust-analyzer","executable_size":39729020,"executable_sha256":"01ed4388725ef878a8682ab086749b8c9f3dfa76cf9ac9a7b173add6075236b3","expected_version_output":"rust-analyzer 0.3.2989-standalone (12c3381f0b 2026-07-26)","license_source_paths":["LICENSE-APACHE","LICENSE-MIT"]},{"platform_id":"darwin-arm64","target_triple":"aarch64-apple-darwin","url":"https://github.com/rust-lang/rust-analyzer/releases/download/2026-07-27/rust-analyzer-aarch64-apple-darwin.gz","archive_name":"rust-analyzer-aarch64-apple-darwin.gz","archive_size":13987778,"archive_sha256":"102215ae7e7a41c0dda8f24e910a01e757f58091204863e5e3e6696b743f7e97","executable_name":"rust-analyzer","executable_size":38192576,"executable_sha256":"c4e9a82238092144191799a0631d21927ea75b8cbf245f79b51d1e89ca9fd760","expected_version_output":"rust-analyzer 0.3.2989-standalone (12c3381f0b 2026-07-26)","license_source_paths":["LICENSE-APACHE","LICENSE-MIT"]},{"platform_id":"linux-amd64","target_triple":"x86_64-unknown-linux-gnu","url":"https://github.com/rust-lang/rust-analyzer/releases/download/2026-07-27/rust-analyzer-x86_64-unknown-linux-gnu.gz","archive_name":"rust-analyzer-x86_64-unknown-linux-gnu.gz","archive_size":15035345,"archive_sha256":"ac4f42ddbbd040d75d847e991894776485783e28beb744b9719a660a99abe115","executable_name":"rust-analyzer","executable_size":42570504,"executable_sha256":"f06d56b784d621794290826d28f30345029122f86fb2223d7dda820de8dc8de6","expected_version_output":"rust-analyzer 0.3.2989-standalone","license_source_paths":["LICENSE-APACHE","LICENSE-MIT"]},{"platform_id":"windows-amd64","target_triple":"x86_64-pc-windows-msvc","url":"https://github.com/rust-lang/rust-analyzer/releases/download/2026-07-27/rust-analyzer-x86_64-pc-windows-msvc.zip","archive_name":"rust-analyzer-x86_64-pc-windows-msvc.zip","archive_size":17612036,"archive_sha256":"7abdf50734026de963b3b25eba7714be8acf43a15ffb7f4f9d8b041e796ce2c9","executable_name":"rust-analyzer.exe","executable_size":38694912,"executable_sha256":"61ad88c3c90a5dece93f590aa31407f69be96023a2536a4f0285bd3def9cb278","expected_version_output":"rust-analyzer 0.3.2989-standalone (12c3381f0b 2026-07-26)","license_source_paths":["LICENSE-APACHE","LICENSE-MIT"]}]}