{"schema_version":1,"kind":"third_party_sources","artifact_id":"gitleaks","tool_version":"8.30.1","upstream_repository":"gitleaks/gitleaks","upstream_tag":"v8.30.1","upstream_commit":"83d9cd684c87d95d656c1458ef04895a7f1cbd8e","assets":[{"platform_id":"darwin-amd64","target_triple":"x86_64-apple-darwin","url":"https://github.com/gitleaks/gitleaks/releases/download/v8.30.1/gitleaks_8.30.1_darwin_x64.tar.gz","archive_name":"gitleaks_8.30.1_darwin_x64.tar.gz","archive_size":8359235,"archive_sha256":"dfe101a4db2255fc85120ac7f3d25e4342c3c20cf749f2c20a18081af1952709","executable_name":"gitleaks","executable_size":22398576,"executable_sha256":"cee01fea7173f1b779dff188e1c26ecbcb4027d394acc573b23aaf0be260e291","expected_version_output":"8.30.1","license_source_paths":["LICENSE"]},{"platform_id":"darwin-arm64","target_triple":"aarch64-apple-darwin","url":"https://github.com/gitleaks/gitleaks/releases/download/v8.30.1/gitleaks_8.30.1_darwin_arm64.tar.gz","archive_name":"gitleaks_8.30.1_darwin_arm64.tar.gz","archive_size":7897593,"archive_sha256":"b40ab0ae55c505963e365f271a8d3846efbc170aa17f2607f13df610a9aeb6a5","executable_name":"gitleaks","executable_size":21324882,"executable_sha256":"ba52fb1bfabbcde42f032afad3d6e0b19dff8ed105229a16e7caa338bbc0e84f","expected_version_output":"8.30.1","license_source_paths":["LICENSE"]},{"platform_id":"linux-amd64","target_triple":"x86_64-unknown-linux-musl","url":"https://github.com/gitleaks/gitleaks/releases/download/v8.30.1/gitleaks_8.30.1_linux_x64.tar.gz","archive_name":"gitleaks_8.30.1_linux_x64.tar.gz","archive_size":8230402,"archive_sha256":"551f6fc83ea457d62a0d98237cbad105af8d557003051f41f3e7ca7b3f2470eb","executable_name":"gitleaks","executable_size":21958840,"executable_sha256":"88f91962aa2f93ac6ab281d553b9e125f5197bbbce38f9f2437f7299c32e5509","expected_version_output":"8.30.1","license_source_paths":["LICENSE"]},{"platform_id":"windows-amd64","target_triple":"x86_64-pc-windows-msvc","url":"https://github.com/gitleaks/gitleaks/releases/download/v8.30.1/gitleaks_8.30.1_windows_x64.zip","archive_name":"gitleaks_8.30.1_windows_x64.zip","archive_size":8438883,"archive_sha256":"d29144deff3a68aa93ced33dddf84b7fdc26070add4aa0f4513094c8332afc4e","executable_name":"gitleaks.exe","executable_size":22575104,"executable_sha256":"17157e2ee8b76fc8b1d8bee607a250e34b8a8023c8bc81822d4b5ee4d78fcb7c","expected_version_output":"8.30.1","license_source_paths":["LICENSE"]}]}